{
  "summary": "细密像素水波，倾斜设备晃动，轻点掀浪。",
  "category": "game",
  "tags": [
    "水波",
    "重力",
    "圆屏"
  ],
  "controls": [
    "倾斜设备改变重力",
    "点击屏幕或短按 KEY1 掀浪",
    "触摸长按 500 ms 切换主题",
    "KEY1 长按或宿主返回退出"
  ],
  "publisher_display": "EEBadge 示例",
  "release_notes": "v11：40×40 网格、400 粒子，水块更细密；无水格子与画布同色，移除浅色灯珠背景。保留五主题和原有操作。",
  "full_bleed": true,
  "rights": {
    "status": "unverified",
    "note": "设计与素材授权说明见 LICENSES.md。"
  },
  "device_verified": false,
  "screenshots": [
    {
      "at_ms": 990,
      "caption": "水波"
    },
    {
      "at_ms": 3300,
      "caption": "切换主题"
    }
  ]
}
