{
  "summary": "圆屏像素小鸟，点击起跳穿越管道。",
  "category": "game",
  "tags": [
    "像素",
    "圆屏",
    "单键"
  ],
  "controls": [
    "点击屏幕 起跳",
    "失败后点击橙色 OK 重开",
    "短按 KEY1 返回应用大厅；支持新固件边缘侧滑返回"
  ],
  "publisher_display": "EEBadge 示例",
  "release_notes": "v6：KEY1 短按返回应用大厅，保留触摸玩法，释放按键给宿主。",
  "full_bleed": true,
  "rights": {
    "status": "unverified",
    "note": "素材来源见 LICENSES.md；原版美术和音效的分发授权尚未核实。"
  },
  "device_verified": false,
  "screenshots": [
    {
      "at_ms": 32,
      "caption": "准备"
    },
    {
      "at_ms": 9900,
      "caption": "飞行中"
    },
    {
      "at_ms": 14000,
      "caption": "结算"
    }
  ]
}
